locale,topic,question,answer
fr,Resultats sur la demande,Sans succes,"Si votre demande est rejeee par un officier de RRO, voust n'etes pas refugie reconnu.Vous avez souvent 30 jours pour donner l'avis d'appel. Atrement, vous devez documenter votre sejour en RSA ou quitter. Les raisons de votre rejet affectent votre appel. Si votre demande etait fraudulente ou abusante, le SCRA devra la revoir. Vou avez 14 jours pour faire une declaration ecrite de votre desaccord avec RRO qui vous a ainsi rejete.Contactez LHR pour l'assistance."
fr,Resultats sur la demande,Appel,"Les avocats prives peuvent vous aider avec votre demande, appel ou et les revisions des decisions prises par SCRA. Vous pouvez avoir besoin de payer ces services. Ou bien contacter LHR, ils peuvent vous aider ou vous referrer. La Societe Juridique Sud-Africaine a une liste des specialistes en droits des refugies - Voir 'Services Utiles'.Conseil: Demandez toujours d'abord les frais de l'avocat avant d'accepter ses services.  Rassurez-vous de l'authenticite des qualifications de l'avocat.Pour verifier, veuillez contacterer La Societe Juridique Sud-Africaine sur: 0123668800.   "
so,najiidad codsiga,guul darada,"Hadii RRO ay didhan odsi gaaga, malagu aqonsaan karo qaxoti aahan. Waxad ledahe 30 malimold, hadii an ahen waad in ad kabaxdaa wadanka SA. Sababta sharciga kuu diday. Hadii qodsigaga been bur ahaa Standing Committe of Refugee Affairs wey firinaya. Waxaad ledehe 14 malimo in ad didmaha. LHR weydi."
so,najiidad codsiga,racfaanka,Sharciyaqanada gaarka ha waxay ka  cawin karaan codsigaga sharci iyo racfaanka iyo wax kle. Hadaba waxaan u malaynyaa in ad adigu bixinaysid ama wac sharci yaqanada .Ayada xuquuqda adamaha waxa  gal ah in ay ku caawin karan talo waydii. Hubi sharciyaqaanka ad rabtoin uu tayo leeyahay si ad u hubiso wac 012-366-8800
sw,Matokeo ya ombi lako,Aliyeshindwa,"Kama RRO anakataa ombi lako,hautambuliki kama mkimbizi uko na siku 30 kutoa taarifa ya rufaa,ama ufanye namna nyingine  ya kuishi au kuondoka SA. Sababu uhathiri rufaa.  Kama ombi lako ulaghai au unyayasaji, Kamati ya Kudumu Mambo ya Wakimbizi watayikagua. Unasiku 14 kupatiana kauli ya kutokubaliana na uamzi katika ofisi ya RRO ilyokupa barua ya kukataliwa.Omba LHR usaidizi. "
sw,Matokeo ya ombi lako,Rufaa,"Wakili binafsi wanawezakusaidia kuombi  hifadhi,rufaa au mapitio ya SCRA . Utalipa ada zake. Au pigia LHR- wanaweza kusaidia au kukupeleka mahali pengine . Chama cha wanasheria wa Afrika ya kusini  wana wakili wenye  uzoefu wa sheria za wakimbizi - Ona 'Huduma muhimu'. Mwanga : Hakikisha wakili ana vyeti maalumu. Kuhakikisha, pigia Chama cha wanasheria  wa Afrika ya kusini kwenye simu 012-366-8800."
fr,Arrestation,Que faire,"Il y a plusieurs moyens de vous liberer. C' est dans votre droit, Si vous etes arretes et possedes un valide permis, demander a une personne de sur de donner la copie de votre valide permis au DHA.Vous avez droit a un avocat lors d' une arrestation. Au tribunale vous pouvez consulter   un avocat gratuitement. "
fr,Arrestation,Conditions,"Verifier les documents au DHA prend 48 hrs. Ayez toujours votre permis, c'est votre devoir. Vous avez des appels gratuits a faire a votre ami pour la copie de votre permis.Vous pouvez declarer par ecrit au DHA le refus de votre detention/deportation.Votre detention est normalement de 30 jours sauf s'il y a une prolongation de la court. So la court prend une decision, vous en etes informes par ecrit, si vous en etes pas d'accord vous pouvez donner des raisons."
fr,Arrestation,Deportation," Si on prend au Centre de Deportation, vous pouvez contactez un avocat. LHR visite le centre chaque semaine. Demandez a votre famille de leur informer que vous desirez un avocat. Si vous etes illegals en RSA, vous serez detenus, puis  deportes dans votre pays.Contactez LHR si vos conditions de detention ne sont pas bonnes ou sont en violation de votre dignite. "
so,xidhtanka,waxa la sameeyo,Waxaa jirta wadooyin oo laguu xidhi karo. Adiga ka yimid sharcigaga in la wahti ayay qaadan. Hada la sharci yaqaankaga ama sxbkaga ama qoyska si ay kugu kobiga. Waxa saxda ah xaq u leedahay in ad hesho matala hadii lagu xidho talo lagu geeyo maxkamada waxaad codsan kartaa caawin si uu kugudoodo lcag la aan.
so,xidhtanka,xaalada,"Waxada waxay xaqiijin karaan 48 saac in aad wadato sharcigaag.  Wajibkaaga hada haday wac sxbkaga ama qoyskaga waxanad ku diidi karta sharciyada in lagugu hayo, xabsiga ama lagu maxkamadu waxay  mudad lagugu haynayo xabsiga waxaanad u cadaynka karta sabta adan u rabin."
so,xidhtanka,masaafurinta,"Hadii lagu geeyo xarunta masaafurinta, waxaad soo waci kartaa talo muhim ah. Xuquuqda adaman soo isbuuc kasta ha. Hubiyan xalada iyo wax ku caawiyo hadii ayna kuu ahayn, wado sharci ood ku sii joogto waii diwaan ka  kuna noqo gurigaga. Wac hadii meesha masaafurinta  amaan ahayan ama  ka jiro ama sharaftada."
sw,Kufungwa,Cha kufanya,"Kuna njia za kisheria zakufunguliwa. Inaweza chukua muda. Omba  wakili.Ni haki yako. Kama umefungwa na kibali halali,ambia  rafiki au familia kupatia DHA nakala ya kibali chako. Kumbuka. Una haki ya kuwa na  mwanasherai kama unafungwa . Tip: Ukienda mahakamani, uliza 'mwanasheria wa bure'. Unaweza kuongea na wakili bure."
sw,Kufungwa,Hali,"Afisa wa DHA analizimishwa kuthibitisha hati yako ya msaa 48. Niwajibu wako ya kutembea na  kibali. Una haki ya kupigia rafiki yako akupe nakala ya kabili.Unaweza kutoa kauli kwa DHA ya kwamba wewe umekataa kizuizi au kufukuzwa. Unaweza tu kuwa kizuizini kwa siku 30 isipokuwa mahakama inaongeza muda. Wakati mahakama hufanya uamuzi wake , lazima upate taarifa  hii kwa maandishi, unaweza kupana sababu kwa nini unakataa"
sw,Kufungwa,Kufukuzwa,"Ukipelekwa kituo cha kufukuzwa,Pigia wakili kwa mashauri ya kisheria. Wanasheria wa Haki za Binadamu hutembelea centa kila wiki. Uliza familia kuwaarifu LHR hali yako na kubambia kama  unahitaji msaada. Kama hakuna sababu na hati sahihi ya kukaa SA, utawekwa kwenye  kituo cha kufukuzwa na utarudishwa nyumbani. Wasiliana na Wanasheria wa Haki za Binadamu kama hali yako ya kizuizini si salama au inakiuka hadhi yako."
fr,Les enfants,Non - accompagnes,Un enfant demandeur d' asile est non accompagne lorsque la personne qui lui prend en charge ne se presente pas.Les enfants separes avec leurs parents avant ou pendant qu' ils quittaient leurs pays sont aussi consideres comme non- accompagnes.
fr,Les enfants,Documentation,"Les enfants demandeurs d' asile qui sont non - accompagnes doivent etre presentes au  DSD, un travailleur social s' occupera de lui. L'assistant social travaille avec DHA pour aider l'enfant avec la postulation de l'asyle au RRO, le travaililleur social fait l'investigation du cas de l'enfant et fait un rapport.Contactez un avocat si l' enfant n' a pas debonne raisons de demande d' asile. Les enfants doivent etre documentes, afin d'eviter qu'ils devennent apatrides. "
so,caruurta,aan wehelinin,ciyaalka markan cidi la socon waxa masuuliyada qadanya waxda ilaalinta ciyaalka ama ciyaalka gaarka ka ah waalidka ama kuwa sida gaarka ah uga soo caray wadankoodi ama goobta dagaaka waa lamid
so,caruurta,diwaanka,"Ima codsanaya magan galyada iyaga oon la socon walid, waxay la xidhiidhi arimah bulsha iyo kadib waxaa qiimayn kiiska adeega.Waaxda sharciyada ka caawinaysaa codsiga, sharciga. Qabilada waaxda adeega bulshad waa in ay baadho ilmaha. Hadii ilmuhu codsan wa in la wargaliyo waana muhiim ilmu haysto."
sw,Watoto,Wasio na wazazi,Mtoto mkimbizi bila kuambatana na mzazi  kama hamna mtu mkubwa ambae ana majukumu ya kumlea na  kumwongoza yule mtoto. Watoto waliopoteana na wazazi kabla au wakati wa wapambano  wanaitwa pia 'Watoto wasio na wazazi'.
sw,Watoto,Nyaraka,"Mtoto akiomba hifadhi bila mzazi/mlezi lazima apelekwe kwenye Idara ya Maendelo ya Kajamii, penye mfanyi kazi wa jamii atashughulikia kesi yake. Mfanyi kazi wa jamii ataunga mkono na DHA kumsaidia mtoto kuomba hadhi RRO.  Atachunguza tena kesi ya mtoto & apeane ripoti kama mtoto hafai  hifadhi. La muhimu: Watoto lazima wapewe hati bila hivyo watakosa utaifa"
fr,Le processus,Eligibilite,"Completez le formulaire d' eligibilite. Repondez honnetement. Vous passerez une interview plus tard pouir donner plus de detail sur votre hisoire. Apportez  tous vos documents qui prouvent votre identite et vos origines. On fera les copies et vouremetra vos orinaux. Apres la prise des empreintes digitales, les numeros de votre case et dossier vous sera remis, gardez-les jalousement. "
fr,Le processus,Libres d'appliquer,"Ne payez rien a qu que ce soit, ni aux agents de la securite, ni aux officiels. Le prcessus est gratuit. Luttez contre la corruption. Conseil: Si un officier du DHA vous demande une corruption, retenez son nom, ses characteristiques physiques, ainsi que la date et le temps de l' incident. Conseil: Pas de raison de payer les frais. Rapportez la corruption au suivant numero gratuit de DHA: 0800601190 .Vous serez anonyme. "
fr,Le processus,Permis,"Vous aurez un permis de la Section 22 (permis du demandeur d'asyle) lorque vous posez la demande; c'est une preuve que vous avvez pose unde demande.Ce permis ne vous donne pas encore le statut de refugie. Ce document vous permet de travailler. Verifiez ou demandez les conditions de votre permis; il est souvent valide de 1 ou 3 mois. Veuillez en faire une copie, toujours gardez ce copie avec vous et renouvellez-le avant que ca n' expire. Un decision peut prendre des mois eo des annees. Conseil: si vous ne renouvelez pas votrepermis section 22 avant son expiration, vous risquerez une arrestation/detention/amendes. "
fr,Le processus,Intreview,"Un interview est prevu lors de la demande d' asile. Il y aura des questions sur vous et votre pays. Vous avez droit a un avocat, interprete ou un temoins, une declaration ou tout autre evidence pour assister . Votre representation ne peut qu'observer. vous auez une decision ce jour ou plustard. Veuillez cachetez votre permis avant de quiter. Les marries seront interviewer tous, s' ils font la demande ensemble.Declarer votre femme ou enfants vivant dans un autre pays dans votre dossier."
fr,Le processus,Interpretation,"Si vous ne parlez pas assez une langue sud-africaine, vous avez besoin de votre interprete si DHA ne vous en a pas donne un(e).Prenez l'interprete de confience qui traduira excatement ce que vous dites et non l'autre qui fabriquera votre histoire pour vous obtenir le statut. Parlez lentement et soyez coherents, demandez qu'on vous relise votre histoire. Demandez a l' officier d' ecrire toutes les corrections. Signez votre formulaire.Votre avocat, temoin, compatriote ne peut pas interpreter pour vous."
fr,Le processus,Droits gratuits,Certaines universites des cliniques juridiques et des organisation de droit de l'home offrent  des services juridiques gratuits aux refugies et demendeurs d'asyle. Le HCR a des conseillers juridiques specilaises dans la loi des des refugies dans 5 cites sud-africaines. les conseillers jusridiques peuvent vous conseiller sur votre demande de l'asyle ou vous assister si votre demande a ete rejeee. ils ne peuvent que vous conseiller. Ils ne donnent pas le loyer ou logement ou bien la nourriture. Voir les 'Services sociaux pour plus d'info. 
fr,Le processus,A propos des avocats,"Les avocats prives peuvent vous aider avec votre demande, appel ou et les revisions des decisions prises par SCRA. Vous pouvez avoir besoin de payer ces services. Ou bien contacter LHR, ils peuvent vous aider ou vous referrer. La Societe Juridique Sud-Africaine a une liste des specialistes en droits des refugies - Voir 'Services Utiles'.Conseil: Demandez toujours d'abord les frais de l'avocat avant d'accepter ses services.  Rassurez-vous de l'authenticite des qualifications de l'avocat.Pour verifier, veuillez contacterer La Societe Juridique Sud-Africaine sur: 0123668800.   "
so,dhaqaajinta adeega,xaq u yeelashada,buxi foomka xaq u lahaanshaha si fiican uga jawaab su alaha lagu waydiinayo tusna dhamaan waraqaha ad wadato kana run sheeg taarikhdad xaqiijina koobiyada kaydina kuwa asalka ah marka lagaa qado faraha waxay ku siinayaan fayl lanbar iyo kiis lanbar e xifdi wa kuu muhiime lanbaraase
so,dhaqaajinta adeega,codsi si xor ah,hana bixin wax lacag ah sida waardiga ama shaqalaha ba waxan waa bilaash adana xaq u leh LOMANA OGALA MUSUQ TALO hadii ay kuwaydiiyaan waxda sharciyada wax laalush ah hubi meesha wakhtiga  talo wac0800601190 si aad u war galiso musuqa waana kuu qarsoodi
so,dhaqaajinta adeega,deganasho,Waxaad helaysaa qaybta 22 aadmarkaad codsato. Waxayna cadaynayaan in aad codsatay ma tihid qaxooti ilaa laguu bilaabo dagananshaha ama shaqada SA. Hubso inaytahe 1 ama 3 bilood. Waado markasto. Markey dacdho cusboneysii. Goanka waxuu bilo ama sanad. Hadaa cusbonesin wa xabsi.
so,dhaqaajinta adeega ,wax waydiin,sharciyo yaqaanada gaarka ah waxay kaa caawinayaan rafcanka.waxa sutagaal inad bixiso qarash.ama laxariir LHR wey kucawinayan. urarka garyaqanada SA. kutakhasusay sharciga qaxotiga. kafirso markasta ad qabsenso qarashka. garyaqnka waino leyahy shadaho.kala xariir halkan 0123668800
so,dhaqaajinta adeega,fasiraada,hadii adan fahmayn luuqada lagag hadlo SA.Waxad u bahantahe turjuman. DHA hada weyso turjuman wainad la imato kada.wa ino noqdo qoof ku kalsontahay. ma ahan iska shega war aad kuhesho sharci.u hadaal si tartiib aah. weydiyi qofka sharicga kusinaya wax kasta.saxiix hadi ad ku qanacsanen
so,dhaqaajinta adeega,si xor ah sharcigana wafaqsan,jaamacadaha sharciyada.kiliinigyada.hayada xuquuda .ururada waxay dalbaan waano bilaash ah sharcigan khusaysa magan galyo doonka iyo qaxootiga  hayada qaxootiga aduunka waxay fidisaa adeeg sharciya akhbar badan laxidhidh waxda  qabilada mana bixiyaan cunto ama daryeel bulsho akhbaar badan ka helo waxda adega bulshada
so,dhaqaajinta adeega,arimaha khuseeya sharciyada,sharciyo yaqaanada gaarka ah waxay kaa caawinayaan rafcanka.waxa sutagaal inad bixiso qarash.ama laxariir LHR wey kucawinayan. urarka garyaqanada SA. kutakhasusay sharciga qaxotiga. kafirso markasta ad qabsenso qarashka. garyaqnka waino leyahy shadaho.kala xariir halkan 0123668800
sw,Mchakato,Uhakika,"Jaza fomu  ya uhakiki. Jibu kwa uaminifu. Utakuwa na mahojiano baadaye ni lazima ili utoe maelezo kutosha ya hadithi yako ya kweli . Leta  nyaraka zote ambazo zinaonyesha wewe ni nani na unatoka wapi . Nakala zitafanywa ili ziweke kwa asili. Baada ya alama za vidole kuchukuliwa ,  utapewa kesi namba na faili idadi . Andika namba hizi muhimu ."
sw,Mchakato,Kuomba bure,"Usimlipe mtu  - hata Maafisa wala walinzi. Mchakato ni bure. Kupambana na Rushwa . Shauri : Kama afisa wa DHA  anakuomba  Rushwa , tafuta  jina lake, andika sifa za kimazingira, pamoja na tarehe na wakati wa tukio hilo. Mwanga: Hakuna haja ya kulipa ada . Piga simu bure ya DHA juu ya kuripoti rushwa kwenye namba  0800-601-190 . Wewe hutajitambua na majina yako."
sw,Mchakato,Kibali,"Utapata kifungo cha 22 (Kibali cha Wakimbizi) Ukiomba.Ni ushahidi.Wewe si mkimbizi.Kibali chako kinakuruhusu kusoma na kufanya kazi SA.Angalia hali ya kibali na ulize kama iko halali miezi 1 au 3.Fanya nakala ya kibali.Weka upya. Tip: Usipo fanya upya kibali cha kifungu 22 ,Unaweza fungwa/zuizini/faini."
sw,Mchakato,Mahojiano,"Utakua na mahojiano ukiomba hifadhi. Maswali  yanaokuhusu na nchi yako. Unaweza leta mwanasheria au mkalimani. Huyo atachunguza tu.Unaweza pia kumleta mshahidi, maandiko chini ya kiapo au ushahidi nyingine. Utapata uamuzi hiyo siku. Pata mhuri kwenye kibali kabla kuondoka. Wenandoa watahojiwa pamoja. Taja  ya majina ya mwanamke na watoto pale popote wako wawekwe  kwenye faili  moja."
sw,Mchakato,Tafsiri/ukalimani,"Kama huwezi kuongea lugha ya SA vizuli ili  ukaeleza madai yako,unamhitaji mkalimani. DHA haitoi  hata mmoja, lazima ujilipie. Pata mtu mwanifu  neno-kwa-neno; siyo mwenye atasema maneno ili utape hadhi ya ukimbizi.ongea polepole na omba wakusomee hadithi yako. Uliza afisa kama kuna mabadiliko. Saini fomu. Mwanasheria ,mshahidi wako au mwenzako hawezi kukutafsiria."
sw,Mchakato,Kisheria bure,Kliniki za sheria fulani  katika Vyuo vikuu na mashirika ya haki za bianadamu hushauri kwa  bure wanaotafuta hifadhi na wakimbizi. UNHCR ina mashauri maalumu wa kisheria katika sheria za ukimbizi katika  miji 5 ya SA. Ona 'huduma maalum' nyinginezo . Mshauri ya kisheria wanaweza kukusaidi kwa ombi ya hifadhi au usaidizi wa kupiga rufaa kama hadhi yako imekataliwa. Mshauri husaidia na ushauri. Hawapeani makao au chakula.
sw,Mchakato,Kuhusu Mwanasheria,"Wakili binafsi wanaweza kusaidia na ombi, rufaa au SCRA mapito. Lazima ulipe huduma. Or pigia LHR-wanaeza kukusaidia. Law society ya South Africa wako na wakili wana utaalamu wa sheria za wakimbizi. Ona 'huduma muhimu'. Tip: ulizia wakili hulipwa ngapi. Hikisha wakili  na kufuzu. Pigia Law Society ya Sa kwa 012-366-8800."
fr,Quand/Ou faire la demande,Durban,"Votre  Bureau d'acceuil des refugies (RRO) a Durban est situe sur l' avenue Moore,  No 132, Durban.Numero de Tel: 031-362-1205 / Fax: 031-362-1220."
fr,Quand/Ou faire la demande,Musina,Votre bureau d'acceuil des refugies (RRO) a Musina est situe sur l' avenue Harold No 8  (a cote du bureau postal). Tel:015-534-5300; Fax: 015-534-5332.
fr,Quand/Ou faire la demande,Pretoria,"Votre bureau d'acceuil des refugies (RRO) a Pretoria - Ouest est a Marabastad, croisement entre les avenues E'skia Mphahlele & Struben.Tel: 012-327-3515; fax: 012-327-5782.  "
fr,Quand/Ou faire la demande, Pretoria Ouest,"Votre Bureau d' acceuil des refugies (TIRRO) a Pretoria - Ouest  est sur l' avenue Soulter No 203, Showground Pretoria. Tel: 012-306-0800/012-306-0806; Fax: 086-579-7823."
fr,Quand/Ou faire la demande,Ville de Cape / Cape Town,"RRO du Cape: Rue Voortrekker No 142, Maitland.Tel: 021-514-8414 Fax: 021-514-8403.Pas de nouvelles demandes, seulement le renouvellement des permis existants des refugies."
so,goorma iyo xagee ayaad ka codsatay,Durban,xafiika kuugu dhaw qabilada q xootiga darban 132moore wada darban wac 0313621205 ama fakiska0313621220
so,goorma iyo xagee ayaad ka codsatay,muusinaa,xafiika kuugu dhaw qabilada q xootiga musina 8 hooladh wadada gurga ku xiga boosta 0155345300 fakiskuna 0155345332
so,goorma iyo xagee ayaad ka codsatay,biritooriya,xafiiska kuugu dhaw qabilaada qaxootiga  biritoorya westi waa maraba istaadh geeska ttelfonka0123273515 fakiska123275782
so,goorma iyo xagee ayaad ka codsatay,biritoorya westi,xafiiska kuugu dhaw qabilaada qaxootiga  biritoorya westi waa sowter wadada maa shaw garoonka telka 0123060800 ama 3060806 fakiska0865797823
so,goorma iyo xagee ayaad ka codsatay,keebtawn,xafiiska kuugu dhaw qabilaada qaxootiga kebtown 142 foootarka wadada milandhi telka0215148414 fakiska215148403 majirto codsi kibtown lkn waa cusboonaysiin kaliya
sw,wakati/wapi kuomba,Durban,"Ofisi ya Kupokea wakimbizi (RRO) karibu yako katika Durban iko 132 Moore Street,Durban. Wapigie 031-362-1205."
sw,wakati/wapi kuomba,Musina,Ofisi ya Kupokea wakimbizi (RRO) karibu yako katika Musina  iko 132 Moore Street (karibu na Posta). Tel: 015-534-5300; Fax:015-534-5332.
sw,wakati/wapi kuomba,Pretoria,"Ofisi ya Kupokea wakimbizi (RRO) karibu yako katika Pretoria iko Pretoria West Marabastad, corner ya E'skia Mphahlele&struben St. Tel: 012-306-0806; Fax: 086-579-7823."
sw,wakati/wapi kuomba,Pretoria West,"Ofisi ya Kupokea wakimbizi (TIRRO) karibu yako katika Pretoria west  iko kwenye Mtaa wa  Soutter 203 ,Pretoria Showgrounds. Tel :012-306-0800 au 012-306-0806; Fax: 086-579-7823."
sw,wakati/wapi kuomba,Cape town,"RRO Cape Town: 142 Voortrekker Road, Maitland. Tel: 021-514-8414 Fax: 021-514-8403. Hamna maombi mapya ya hifadhi, ila wanaogongesha  wana hifadhi za zamani tu."
fr,Vos droits,Travail,Tout demendeur d'asyle ou refugie ayant un permis valide a le droit de travailler en RSA. Vous obtenir un emploi  ou faire vos propres affaires.Vous n' avez pas besoin d' un extra visa
fr,Vos droits,Sante,Vous avez le droit aux soins medicaux de base en RSA.On ne peut vous refuser les soins medicaux d'urgence.Les agents de l' hopitaux sont parfois sous informes sur les droits des refuges et demandeurs d'asyle avec permis valides. Vous pouvez contacter LHR si vous n' avez pas acces aux soins de sante publics.  
fr,Vos droits,Education,Toute personne a le droit d' ecation de base en RSA.Vous devriez avoir un permis d' etude valide en RSA.Etes-vous en RSA sous un different permis valide? Verifiez si votre permis vous permet d' etudier en RSA.Quleques conditions pourraient etre applicables
fr,Vos droits,Aliment & Logement,"Vous droit sur: l' alimentation, eau et .Les organisations offrent une assistance limiee, par la suite, vous devriez prendre soins de vous memes. Voir 'Sevrices utiles' pour les organisation religieuses qui peuvent assister. Le gov. de la RSA, ONGs & HCR interviennent dans des cas speciaux. Le HCR a un role limite en RSA (sans camps des refugies). L' assistance maigre est apportee aux plus vulnerables personnes (mamans et enfants qui sont en RSA pour moins de 2 mois, homes celibataires avec des beoisns speciaux, les malades & handicapes). L'assistance peut comprendre la nourriture et loyer de base pour 3 mois. La pluspart des communautes des refugies donnent peu d'assistance materiel mais donne le soutien. Vous avez l' acces aux soins de sante public et education."
fr,Vos droits,Eviction,Les lois protegent les immigrants d' un eviction illegale.Le bailleur devra avoir un mandat d' eviction avant d' agir.Seulement le tribunal peut vous expulser.Contacter le Tribunal des Locations des Maisons sur: 0116305035/0800046873 s' il y a une dispute ou vous etes maltraites.
fr,Vos droits, LGBTI,"La constitution sud-africain protege les LGBTIs.Les victimes doinvent rapporter leurs abus a la police, ou au SAHRC.Veuiller demander l'assistance juridique si vous avex des problemes pour ouvrir des cas. Voir la Liste de Contact pour plus d' info.Le soutien des LGBTI: GALA a Johannesburg: 011 717 4239, ou Pretoria,  Wellbeing : 0124303272/ Gay & Lesbien Network a Durban: 033 342 6165.  "
fr,Vos droits,Abus,"Les femmes etles enfants ont le droit de vivre sans abus. toute sorte d'abus doit etre rapporte a la police.Souvenez-vous qu'une ordonnance de protection vous epargne de plus de violence. Violence peut signifier l'intimidation, abus physique, sexuel ou verbal ou lorque vous perdez votre liberte.L'abus des femmes et des enfants est illegal en RSA. Obtenez une assistance legale gratuite des organisations des femmes et enfamts ou appelez au 0800-150-150."
so,xuquuqdada,shaqada,qofka kasta oo qaxootiya waxuu xaq u leeyahay sii joogitaanka k africa ilaa inta sharcigiisu ka shaynayo umana baahnid dal kugal dheerad ah
so,xuquuqdada,cafimaadka,"waxaad xaq uleedahay inaad hesho adeeg caafimaad waxaana reeban in laguu diido adeega caafimaad ee degdega ah, xusuusnaw dhamaan shaqaalaha goobaha caafimaadka iyo dhakhaatiirtu mayaqaanaan xuquuqda qaxootiga iyo magangalyo doonka haysta sharciyada saxda ah , markaa lasoo xidhiidh qareenada xuquul insaanka."
so,xuquuqdada,waxbarashada,qofkataa waxuu xaq u leeyahay helida wax barsho k.afrika hayso nadamka sharci shaqaynaya hubi in uu kuu ogolaanayo in aad sii wadato hadi yna wax kaa khaldaayn waad sii wadan kartaa
so,xuquuqdada,cuntda iyo guriga,waxaad xaq u leedahay helida cunto biyo hayada guryaynta iyo dalab xadidan si laguu cawiyo lkn waan in aad aftada cawiso kadib wad arki adeega sida deemaha oo kle iwm waain aadfiiriso bulshada dhaqaalaha ay u bahan yihiin dawlaada k afrika iyo hayada ha aan dawliga ahayn maa h.q.aduunka  waxay caawiyaan kiisas gara ah waxaana xadada ya sharciga k.afrika sabtu  ma jirto xero lamana cawin karo dhaman bahida jirta gud ahanba hayada ha aan dawliga ahayn waxayna bixiyaan adeeg xadadan x.qabilda q. waxayna cawiyaan hoyada ilmaha dhalan in ayar2 bilood nin kaligii ah kas oo xanuunsanaya ama laxaad la aana waxana laga caawiya sida cuntada iyo qalab  wan suurta gal in aan si guud ucawino adega bulshada
so,xuquuqdada,guri ka saarida,Sharciga difaacaya qaxootiga  ama magan galyo doonka. Mamulka guriga waa in u ladadha sharci.O gow maxkamada maku qasboso. Mamulka maku qasbi karo inad guri geda katagtit. Waac tribuna kiradha guriga 011-630-5035 ama 0800-046-873 hadii ad umaleynaeyso xaaf daro ina laguguheysto.
so,xuquuqdada,arimha guurka iyo galmada,SA waxy difaacday dhamaan sida galmada jinsiga. Isku midka ah sharciyan  ama waxa loo soo gabiyo(lgbti).Hadaba hadad tahay dhibane wac waaxda wargalinta danbiyada sida nacayka hadal wax joohaanisbeg gala 0117174239 ama biritoorya wac wibegi0124303272 ama darban wac kkanisinta ama isku xidhka0333426165
so,xuquuqdada,xadgudubka,"Haweenku iyo ciyaalka waxy xaq uleeyihiin in ay ku nooladan xor. Hadey jirto xaad gudub daan bolisa usheg. Xadgudub wa handaada jirka,galamada, xagudub waxey dici kartaa marka aad hor weyso. Xadgudub wa sharci daraada ah SA. Cawis oo dumarka iyo carurta wa uruka waac 0800-150-150- tagero iyo talabixin."
sw,Haki zako,Kazi,Kila mkimbizi au mwombaji wa ukimbizi mwenye kibali halali ana haki ya kufanya kazi SA. Unaweza kusajiliwa au kufanay biashara yake mwenyewe. Hauitaji kibali cha kufanay kazi.
sw,Haki zako,Afya,Una haki ya matibabu ya afya na uzazi SA. Huwezi kakataliwa matibabu ya dharura . Wafanyi kazi wa hospitali hawajui muda wowote haki za wakimbizi au wombaji wa ukimbizi wenye vibali halali. Pigia Wanasheria wa Haki za Binadamu kama unashidwa kupata huduma ya afya.
sw,Haki zako,Masomo,Kila mtu ana haki ya elimu ya msingi SA. Lazima uwe na kibali halali kusomea SA. Uko nchini kwenye kibali  kingine  halali? Angalia kama kibali chako kinakuruhusu kusomea SA. Masharti mengine anaweza  kuhusika nawe.
