lang,topic,question,"answer"
so,cusboonaysiinta daganashaha,dib u cusboonaysiin,"Cusboonaysiinta waxda 22 ad ee qaxootiga. Waxada qaabilada gal safka inta ayna kaa dhicin qaxootiga. Gudida dib u sharicyada qaxootiga ayaa ka go aan gari. 24 aad ka waxuu shaqeeya 2 ilaaa 4 sano ka hor inta uuna kaa dhicin tag (SCRA) sharciga ah waa in aad wadato marka aad cusboonaysid."
so,cusboonaysiinta daganashaha,ganaaxa,"Waa lagu ganaaxi hadan cuboonaysiin sharigaga. Lacagtuna waa in aad tahay danbiile. Aan waxayna horseedi kartaa in lagu qoro dabiille hadii ad haystao sabab taas oon in aad sharcigaga wac sharci, yaqanada in kaa caawiyaan qaabilada. Waxy ku waydiin ganax R1000 TALO dagansha maha mid markaasba la cusboonaysiisyo."
so,cusboonaysiinta daganashaha,lumitaanka deganaanshaha,"hadii sharcigu kaa lumo soo qoro cadayn ka socota booliska gubi qoraalka iyo koobigaag hada hayso xafiiska qaabilada qaxootiga talo luminta sharcigaag way adag tahay samee koobiyo badan u kala dhiibo qoyskaga iyo sxbdaa wali kiis lanbarkaga"
so,cusboonaysiinta daganashaha,degaanka,"marka laguu aqoonsado qaxooti kdi ad jogto 5sano waxad xarayn karta daganaasho rasmi ah qaynuunka sharciyad la dhigay 2002 ayaad wax badan ka helaysa codsiga daganaansho rasmi waa waxamuhim u ah helida ogolaansha gudiga sharciyada joogtda taas oo odhanysa waad sii ahaan kartaa"
so,cusboonaysiinta daganashaha,codsiyada,"5sano waxaad siiwadi kartaa dagansho, si aad u dhamaystirto xaqiiji. In aad gadhay codsato sharci la kashataa hayada sharciyaqaanada .. kuu ad hesho guboi waxad sharciyada, aqoonsigaag waxayna ku dukumiintiga ad ka haysato hana bixin waxba si aad u hesho dagansho rasmiya."
so,shaqada,shaqaynta,"kuwa haysta magan galyada way shaqayn karan ilaa inta uu ushaqaynyso warqada magangalyada loogamana baahna dalkugal"
so,shaqada,lahaanshaha ganacasi,"Ganacsigaaga waxda ganacsiyada hel ogolaansh. Waxa laga heli kara hoose bixi iyar oo ah koobiga dagansha haga iyo wax yalo.Sida arimo cafimaad.Amaan kormeer ha samayn laluush gaar ahaan marka loga baahda wax wad heli fasax in aad la socoto shuruucda markasta hubi wakhtiga dgicitaankaga ogolaanshaga."
so,shaqada,xeerka gobolka,"hubso sharciga gobalka aad joogto ama aad rabto in aad ka ganacsato sida darban ama linboobo/buumalanga/waqooy/w/galbeed waxaad u baahan tahay aqoonsi caafimaad xaqiijinta arimaha amaanka sharcigana cusboonaysiin inta uuna dhicin hal bili ka hor hadii klae waxaa suurta gal ah ganaax ama xabsi in aad la kulanto darban ma awoodid in aad badasho guriga ganacsiga fasax la aan gacansiga guriga hortiisa ama wadada uma baahnid liisan lkn waxaad u baahan tahay in aad cadayso in ay tahay goob adeeg gaar ahaan markaad gobalkan khawteen waxaad la xidhiidhi kartaa hayada u dooda sharciyaqaanada xuquuqda adamaha adiga oo wata koobiga sharcigaaga iyo waxaayalaha muhiimka ah"
so,shaqada,xeerka magaalo,"sharciga dawlada hoose waxaa lagu yeedhi karaa sharci xadidaada sida ganacsiga iyo adeega kale sida shaqada goobaha ay adeega ka bixiso waxaa lagu xish meeyaa sharciga dawlada hoose hadad rabto in aad ganacsato TALO muhiim ah si aad u adeecdo dhaman sharcigayada lagaaga baahan yahay hadadn la socon sharciga waxaad lumisay hantidada ama waxaad kasbatay xabsi waxaalaha kugu haboon dhinaca sharciga waxaad la xidhiidhaa www.capetown.gov.za www.tshawane.gov.za www.durban.gov.za www.nelsonmandelabay.gov.za www.joburg.gov.za"
so,shaqada,amaanka iyo macalinka,"amaanka ama ilaalada waa in aad la xidhiidho shirkada gaarka loo leeyahay ee amanka waxaa aad kula shaqayn kara kuwa haysta dhalashada konfur africa ama daganaasho rasmi ah sidoo kale qaxootiga awooda u leh in ay buuxiyaan shuruudaha waxay ku shaqayn karaan sida macalinka hadii aad tahay mid ku shaqayna ya macalinimo dad waynha ah waa in aad hubiso tayadada macalinimo waxada qaabilsa(kaht)saqa) hayadaas ma xaqiijin karto in aad heli shaqo waxaa kale ood iska dawaan galin kartaa (waxada u qabil san k afrika waxbarashada)waxanad boqan karta www.sace.org.za in badan o wara"
so,shaqada,kalkalisada cafimadka,"qaxootiga awooda u leh in ay noqdaan kalkaaliso caafimaad waxay iska dawaan galin karaan(sanc)waxda dawaan galinta kalkaalisooyinka k afika)waxaad ku gudbin kartaa shahaadooyikaga www.sanc.co.za waxaanda u bahan thy in aad gudbisao liiska dhan"
so,shaqada,dhakhtarka,"Daxatirto heystaan sharciga caxotiga SA. Waxaa cafimaadka u ah in ey letyihin wayo-aragnimo. Diwaan isbitalada iyo barnamijada 012-312-0467 hadii ad do neyso shaqa iyo xaruunta cafimadka. Xayeysin u furo FWMP o shaqo iro xayaysin. Isko so roof xaruunta cafimadka SA 012-338-9350."
so,shaqada,midab takoorka,"Wadanka SA waxaad xaq u leedahy in aad hesho difaaca midab ama hanjabaad. Marka aad joogto shaqo cida aad la shaqaynyaso kuma takoori karaan sababtoo ah tahay sharciguna. Sharciguna difaacayaa shaqo mushahar kaaga iyo sababta aad ku wayday."
so,shaqada,helitaanka xuquuqda canshuuraha naftaada,"waxaad sheegan kartaa waxii khuseeya dhawac goobta shaqada ama in ay ilmaha wax kaa soo gaadheen ama aad shaqo laan ad tahay ama xanuun ku hayo shaqada dhexdeeda ama ama aad laxaad beeshay waxaa bixinaya waaxda magdhawga xataa haddii aad dhimato ama aad hdaawacabto waxayna kaa cawinayaan dawada iwm"
so,cafimaadka,xuquuqdada,"Waxaad xaq u leedahay in aad hesho caafimaad ama daryeel SA. Mana diidi kartid degdega ah ama dawada odow xuquuqda aad leedahay. Maganalyo kaas oo haysta sharci shaqaynaya waci kartaa sharciyaqaanada u dooda xuquuda hadii aad dhibaato adeega caafimaadka."
so,cafimaadka,qiimaha cafimadkaagu ku kacayo,"Qaxootiga ama soo galootiga waxay bixiyaan waxoogee guno ah oo laga qaado. Ogaw waxa lagaaga. Waxaad gunada ugu qaalisan waxaa lagaag baahan .Aqoonsigaga meedha aad dagan tahay talo kolka goobta caafimaad ee kugu dhaw(clinic) hadii ayna ku caawin karin, waxay kuu qorayaan ama hadii aad tahay arin degdega toos."
so,cafimaadka,dhakhtarka iyo kiliinigyada,"Caafimaadka waxay kaa caawinaysaa dhinaca waa bilaash. Ka qabso cafimaad ee kuugu dhaw sharcigaga oo shaqaynaya(your valid saction 22 ) fiirso adeega muhiimka kuu ah si aad waxaad u baahan tahay. Caafimaad ee kugu dhaw wax guno ah na ma bixinaysid hel cadayn boolis si ay u goobta gaarka loo leeyahay."
so,cafimaadka,jah wareeerka,"Dhibka iyo jahwareerka, Xadgubka/xanuunka.Dabeeciga ah waxay kuu hor seedi kartaa fikir iyo qas aan cadi ahayn waxaas ka sii daa waxaanad u in aadan helin caawin kugu filan la wadagi hayada ay khusayso arim,aha waxaana jira goobo cafimaad oo ka shaqeeya arintaas sida joobeeg ama kebtown si toosa."
so,cafimaadka,cudurka dilaaga ah ee aydhiska,"xanuunka dilaaga ah e aydhiska hel toban sano/10sano oo dawo ah walib si deg daga ayaa laguu caawin waxayna kuu hor seedi xalad caadi ah tabar yareda aydhiska ayay wax badan ka taraysa iyo la dagaalanka xanuunka infakshinka sida dhiig la aanta hadii aydhis jiro waa xanuun halis ah waxaanad iska ilaalisaa galmo aan lahayn difaac wax la istimalay sida xiirintaanka ama alabta afka leh hadii aydhis ku hayo hadana aad uur leedahay waxaa suurta gal ah in ilmahaagu yesho mrkuu ka soo dago makankkadib dhalshada ama quudinta naaska hdaba ,, talo,, wax dhiba malah hadii ad dhunka to ama aad wax la wadaagto"
so,cafimaadka,baadhitaanka aydhiska,"Ogow xanunka aydhiska waxaad u baahan tahay in la baadho. Diyaar ku yihiin kooxa baadhidu waa bilaash. Mararka waxay qadataa 20 waxuu toos ugu dhacayaa rugta waxay qaadato.Waxaana kawada shaqeeya hayada badan SA habka caafimada xanuunka ama dawaynta waxaad la xidhiidhaa www.tac.org.za kala xidhiidh."
so,cafimaadka,arimaha khuseeya ka difacida hoyada uurka leh aydhiska,"qofta uurka leh hadan aydhiska qabta waxay ka codsan kartaa goobta caafimaadka kiniinka la dhahonerafobin(nervirpine) waxuu ka difaacaya xanuunka dilaga ah iyo infakshinka la xidhiidh www.tac.org.za waaxada dawaynta"
so,cafimaadka,qofka la nool xanuunka dilaga ah iyo qabka u dawada u qaato,"Waxada la dagaalanka xanuunka dilaaga bilaaban markii uu khadar gadho. Marka ama uu hoos maro 350 c inta bada waxay bilaaba taa ama ay gaadhaa 8 ilaa 10 sano inta badan isku mid ma noqdo. Dhakhtarka hel dawo lamana xidhiidho waxa sharcigagu yahay la xidhiidha cida aad tahay e waa in aad hesho daaawayn bilaasha."
so,cafimaadka,xadgudubka galmada,"Hadii lagugu kufsaday toos u aad booliska. Ha qabaysan ama ha galin musqul. Waxay kaa cadaynta dharka waad badalan kartaa in aad war galiso. Hadii hore waxay noqonaysa in ad qadato. Waxaad xaq u leedahay 28 difaacda xanuunka dilaaga ah lkn waa in ay qadato 72. Jacelka 0800121900, cawis 0800012322 AID 0800110605."
so,waxbarashada,xuquudaada,"qof kastaa waxuu xaq u leeyahay waxbarasho k afrika waa in aad haysato sharci shaaynaya ama ogalaansho wax barasho hubina inta uuna kaa dhicin sharcigaga ayaa kuu suurta galin kara wax barasho waxaana surta gal in wax ka baxsan laga bahdo"
so,waxbarashada,isgoolka,"Goob dar yeel ciyaalka malinta waa qab isgool inta u dhaxaysa 1-6 sano dugsiga hoose wxaa gali kara 7-13 dugsi dhexe 13-19.Hadii adan bixin karin waydii ku ka jaban ood bixin kartid waa sharciyo SA.Talo mararka qaar waxaa dhacda in ilmu tago galaas uu marka sawladu iyadu ma ogala in ka badan labo sano u kor dhafo."
so,waxbarashada,codsigaaga,"sida magan galyada ama qaxootiga ciyaalku waxay xaq u leeyihiin wax barashada as aasiga k afrika diwaan gali isgoolka kuugu dhaw hadii adan ingillska adan ku fiicnayn kaxayso sxb ku caawiya si dagdaga u codso isgoolku in uu buuxsamo ayaa laga yaaba haduu kaa buuxsamo wan in aado waaxda wax barashada hadii laguu diido isgoolka waan in ay warqad ku soo siiiyaan taas oo leh saxeexa madaxa xafiiska hadii kle la xidhiidh waxda adeega bulshada dhinaca wax barashada ama sharciyaqaanada u dooda xuquuda adama la xidhiidh"
so,waxbarashada,talooyinka,"waalidku waa in ay diwaan galiyaan ilmaha si saxa xidhiidhkaaga mesha aad tagan tahay boostadada telefoonkaga shahaadiga isgooka kobiga sharcigaga/kiisa warqada talaalka ama tisa cafimaadaka ilaa sedex bilood"
so,waxbarashada,gunada isgoolka,"hadadan awoodin in aad bixiso gunada isgoolka waydiiso in ay k dhimaan gunada tus warqada aad lacagta ku qaadato/cadayn io qoraal aad ku cadanayso codsigaaga taageere ka war bixi masuuliyada ku saaran sida aad wax u mamusho codso in lagaa cafiyo bilowga qoraalka ilaali dhamaan qoraalada balamaha isgoolka hadad is dhaga mariso ogasiisyada ama haday ku diidan waxaad la xidhiidhaa hayadaha aan dawliga ahayn cadsi qoraal ah sida dharka isgoolka o kle hadii uuna ilmahagu haysan dharka isgoolka xataa wuu adi karaa ama mid u eg ayu xidhan karaa ta labaad waxaad waydiin kartaa isgoolka mesha jaban isgoolka dad wanaha kuma wadiin karaan lacag guna ah isgoolka dadwaynaha"
so,waxbarashada,wax yalaha aad si gara ugu bahantahay,"wax barashada gaaraha aad meelaha sida gaarka ah wax loogu baro ciyaalka la xidhiidh waaxda wax barashada gaarka ah wadii messha waana arin wakhti qaadan karta hel liiska lagu qoro ciyaalka sida ugu suurta galsan"
so,waxbarashada,jamacada,"waad sii kordhisan karta aqoontaada, wadna badali kartaa culuumta aadbaranayso adoo iskubadalaya aqoontii dalkaga iyo aqoonta sare SA, shahaadada nooca sare ee SA waxay kaa caawinaysaa heltaanka shaqada, inkasta oo aqoonta qaxootiga aan damanad lasiinkarin hadana bari jaamacada farsamada lana xidhiidh qaybta farsamada iyo aqoonta dibada ee kuliyada aad baranayso. adoo waydiinaya heerkooda"
so,waxbarashada,tallooyin gara,"Waa in aad bixiso diwaan galinta ah. Barashada caadiga ah waxaad u gubin kartaaa. Waxada xaqiiji luuqada ingiriiska. Shahaadigaaga waxbarsho iyo koobiyada aad haysto. Kadibna hubi deeqdada wax barasho waxaad la xidhiidhi kartaa qaxootiga waxda waxbarshada waxyna hawshan haysay 28 sano taas oo ka koobnayday noocyo."
so,waxbarashada,wax barashada dadka waa wayn,"Mararka qaar waxaa dhacda hayadaha aan dawliga ahayn iyo gudiyada. Wax barasho dadka magan galyo doonka. Inta badan wax barashda dadka waawayn waa bilaash. Waa iskaa wax u qabso sida luuqada ingiriiska ama xirfado u ah shaqada. Dadka waawayn waxay kugu dhiiri is dhexgalka waxyaalo mihiim."
so,cuntada/seexadka/bangiyad,xuquuqdaada,"Waxaad xaq u ledahay cunto biyo guri. Hayada qaar way kaa caawin karaan xusuusin u tahay qaxootiga iyo magangalyo. Dadaashaa in aad adigu is caawiso waxa kale. Diimaha ka shaqeeya waxay mararka qaar waxay bixiyaan waxaa;laha loo istimalo jikada iyo musqusha waxayna u badan tahaysida kinisada"
so,cuntada/seexadka/bangiyad,adeega baahida degdega ah,"hayadaha qaar waxay kaa caawinayaan in aad hesho waxoogaa. Sida guri la aanta waxaad aragtaa waxa muhiimka. Waaxad kala socon kartaa khuseeya daryeelka jaraa idada ama xarumaha. Wakiilka ka ah bilowga bil kasta waxa laga yaaba in lagu way diiyo lacagta inta adan ka bixin guriga ama adan tagin waxaana muhiim."
so,cuntada/seexadka/bangiyad,guri ka saarid,"Sharcigu waxuu difaacaya qaxootiga iyo magangalyo. Sharci daro ah lagaga saaro guryaha ninka guriga, an maxkamad inta uuna huriga ka saarin in xoog uga saaro ama uu u hanjabo haday taas dhacdo waxada u xilsaaran guryaha 011-630-5035 ama 0800-046-873 hadad dareento hanjabaad."
so,cuntada/seexadka/bangiyad,dhib xaga bangiyada ah,"Hadii ay kugu adagtahay in aad furati akownti bangi SA. Ogato xaq qaxootiga iyo magan galyo doonka marka shaqaynayo hadii ay ku diidaa.Furo akownti waxaad ogaato in ay istimaali karaan warqada sharciga ama aydhiga waliba bangiyada FNB IYO STARDARD baangi waydii meesha kugu dhaw eed ka furan karto"
so,cuntada/seexadka/bangiyad,akowntigaga iyo iwm,"waan in aad noqoto 16 sano iyo kasii wayn sharci shaqaynaya waan in ad haysto waa in ad gacanta ku wadato aqoonsiga qaxootinimo iyo cadayn meesha aad dagantahay kirada aad bixiso warqada ad wax ku qadato mama dakhligaga akown furashdada waxaad u martaa wado sharciya waxay kaa cawin in aad furato durba"
so,cuntada/seexadka/bangiyad,qaybo kale,"kayd sashada iyo amahaha waa kuwa lagala shaqeeyo qaxootiga ama loo furo sida dadka jamaca ah kuwaas oo si wada jira wax ugu rita mel kuwaas maha ku caadiga ah"
so,deeqda bulshada,wax khu seya adeega,"aqoonsiga qaxootiga wa xay awoodaan caawin bulsho xaalado badan awgeed loogamana baahna warqada sharciga qaxootiga"
so,deeqda bulshada,laxaad la aanta,"tan ku meel gaadhka ah ama daganshaha ah waxay xaqiijinaysaa qaxootinimada kaas oon shaqayn karin marka loo fiiriyo xanun xaga maskaxda ah ama dhinaca jidhka ah sida laxaad la aan sidoo kle ciyaalka ka yar 18 sano ayaa ka mida wayna codsan karaan"
so,deeqda bulshada,ilaalinta waraqaha laysu diro,"aqoonsiga qaxootinimo ee soo caydhinta waalidka waxay iska diwaan galin karaan waaxda arimaha bulshada iyo hormarinta si ay u codsadaan daryeel xusuunow waa in ay maxkamad xaqiijiso in lagugu khasbay waxayna laguu balan qaadi karaa ilaa 2 sano wakhti ku eg"
so,deeqda bulshada,gar gaarka bulshada,"sadaqada bulshada ka timaada waa wax xadidan k afrika arimaha khuseeya waxay iinta waxaad u baahan tahay codsiga meesha kugu dhaw u aqoonsashada baahida sida saasa/sassa waxaanad iska diwaan galin kartaa mesha kugu dhaw adiga oo qadanaya dukumintiga aad haysato una gubi"
so,deeqda bulshada,codsiga,"Xaqiijin kasta waxay u bahantahy qeexid iyo cadaymo sharciyo ama cosiyo si laguu caawiyo. Waxaad booqata www.sassa.gov.za ama wac0800-60-10-11 waana in aad ka codsata saasa/sassa xafiiskeeda kugu dhaw."
so,deeqda bulshada,arimaha khuseeya hayada caydha bixisa iyo kuwa lamidka ah,"EC: BKB Bui, corner of Fitzpatrick & Merino Road, Quigney; Tel: 043-707-6300; Email: GrantsEnquiriesEC@sassa.gov.za NC : Du Toitspan Building 95-97, Du Toitspan Road, Kimberley: Tel 053-802-4900 ; WC : Golden Acre, Adderley St, Cape Town Tel: 021-469-200; Email: GrantsEnquiriesWC@sassa.gov.za"
so,deeqda bulshada,arimaha khuseeya hayada tageera qaysaska danyarta ah mesha sida kuwasulu natala,"FS: African Life Bui,75 St. Andrews Street, Bloemfontein Tel: 051-410-0804/5 Email: GrantsEnquiries@sassa.gov.za GAUTENG 28 Harrison St, Johannesburg Tel: 011-241-8300 Email: GrantsEnquiries@gov.za KWAZULU-NATAL 1 Bank St, Pietermaritburg Tel: 033-846-330 Email: GrantsEnquiriesKZN@sassa.gov.za"
so,deeqda bulshada,arimaha khuseeya hayada caydha bixisa iyo kuwa lamidka ah gar ahan linboopo,"MPUMALANGA: 18 Ferreira St, Nelspruit. Tel: 013-754-9428 Email: GrantsEnquiriesMP@sassa.gov.za NORTH WEST: Master Centre Industrial, Mafikeng. Tel: 018-388-0060 Email: GrantsEnquiriesNW@sassa.gov.za LIMPOPO: 43 Landros Mare, Polokwane Tel: 015-291-7400 Email: GrantsEnquiriesLIM@sassa.gov.za"
so,amaanka ama dib u dajinta,jinsi nacaybka,"jinsi nacayku waa ficil nacaysho kaas oo lagula kaco kaliya dadka aajaanibta ah wana bila sabab aan hore loo arag hadaba hadad tahay dhibane lagula kacay jinsi nacayb waa in aad war galisa booliska kuugu dhaw goobtaada waa in aad u sharaxdo say wax kuu gaadheen boolisku waxay kuu furayaan kiis lanbar waa in aad xajiso kiis lanbarka hadii aad lumiso sharcigaga waan in aad booliska ka soo qorato cadayn boolis taas oo cadaynaysa say wax ku gaadheen iyo xaladada kadib aad xafiiska qaabilaada qaxootiga si aad u hesho sharci cusub"
so,amaanka ama dib u dajinta,dibudajinta,"Mararka hayada qaxootiga aduunka waxay waxaycaawisaa qaxoootiga si ay meel uga kaxayso. U dajiso ama dib u dajin waaana afar nooc/4 1 dib u dakin wadanka gudihiisa ah 2dib u celin. Qoys dib u dajintu maaha nooc ka mida magan. Hawlo u gaara hayada qaxootiga, aduunka taas oo lagu xaalada iyo aduunka."
so,amaanka ama dib u dajinta,magangaliyada wadan sadexaad,"Dib u dajintu wa caawin qaxooti iyada ama isaga badhaha. Qoyska sida ninka ama naagta/ciyaalka oo kale wana la xidhidhi kisas la aqbalay. hadii SA qaxootiga wadanka waana dhibaata guud o. Wadanka dhan ama jinsi mana khusayso codsiga dib u dajinta aduunka waxay isku in ay kwarato bayada inta ayna dib u dajinta."
so,amaanka ama dib u dajinta,shuruudaha,"hadii ayna amaan ahayn wadanka SA. Qaxootiga SA waan laga codsado. Si cawin loga helo waxad haysta 4 nooc oo dib u jin ah danbiga SA ama jinsi nacaybka ama shaqo la aanta kuwaas looma codsan karo dib u dajin hayada qaxootiga aduunka waxay isku dayda cimiri dheer bayada in ayna go aansan dib u dajinta."
so,amaanka ama dib u dajinta,codsiga,"utag UNHCR doo balanka qabsanaya malinka isniinta, unhcr waxay lakulantaa qaxootiga maalinka taladada ah, unhcr waxay fiirindoontaa codsigaaga haday codsigaaga kuqanacdo waxay kuu gudbin wadan sadexaad hadii wadankaasi kuqanco in lagu siiyo degenaansho waxaad mari maraanmar kale waxana maridoontaa caafimaad, wakhtiga waxa laga yaabaa inay 1-ilaa 2 sano qaadato."
so,amaanka ama dib u dajinta,dib u dajinta k.afrika,"dib u dajinta caalamiga ah waa kaxayn qaxooti iaga iyo qoysas koda SA. Xalada karo u dhawdahay in aad hesho nolol ka fiican hayada q, aduunka qaabka dib tusale ma codsan kartid baabur raac hadaba.hadii aad tahay dib u dajin gudaha ah kuu radin meel aman ah lgaadhi raca way kaa cawin karaan."
so,amaanka ama dib u dajinta,celinta,"Dib celinta iskeeda waa marka qaxootigu goosto in uu noqdo gurigiisa. Foomka codsiga h,q, aduunka,ama sharciyaqanda.u ,x, adamaha waxay kula karaan su aalo t sharciya. Xaqiijiso akhbaaratada waxana dib loogu dirayaa taloyinka unhcr/HQA ama IOM/HSA iyagana ka go aan gadhi doona talooyinka aad ku noqon"
so,amaanka ama dib u dajinta,dib u midaynta,"Hadii ad is waydeen xubno qoyskaga ka mida ah intii qaxaysay. Kugu la noolan karaan halka aad jogto xaalada la aqbali karo unhcr/HQD waxay kaa caawin karaan safarka si ad u codsato la xidhiidh/HTL/UCTM\ama a qaxootiga waana in aad codsiga ka soo bilowdo waxda sharciyada gar ahan xafiiska qabilada qxootiga."
so,amaanka ama dib u dajinta,raadka qoysaska,"hayada lanqayrta cas SA. Sidoo kale HQ ADUUNKA WAXAY KAA CAWINAYAAN dib u midaynta qoysaska difaaca ciyaalka. Nadaanka kuu caawin karto hayada. Xidhiidh u qofka iyo qoyskiisa sida in meel uu kala xidhiidho. Shaqadoodu qof meeshee ugu danbaysay cida halka laga heli karo hawlaha."
so,xuquuqda guriga iyo galmada,xuquuqdad guriga iyo arimaha galmada,"sharciga wadanka waxuu difacayaa galmada arimaha la xidhiidha sida khaniiska iyo jinsiyada hadaad tahay dhibane habdhaqankaas waa in aad wacdo booliska k afrika ama hayada arimahs u dooda ayaad la xidhiidhi kartaa"
so,xuquuqda guriga iyo galmada,amaanka arimaha khuseeya guriga dhexdiisa,"hab dhaqanka qaxootiga arimaha gal,mada hadii koox ad tihiin waxaad difaac ka heli kartaa xeer ilaalinta nadaamka galmada hana ka cabsan habdhaqanka galmada xilyada aadc wax codsanayso oo kale sida sharcga wana in aad u sheegto si kalsooni ku jirto"
so,xuquuqda guriga iyo galmada,caawinta guriga dhexdiisa,"la xidhiidh H SH U DOD XUQQUDA ADAMAHA iyo kuwa kale ee sharciyada booqo www.LHR.org ama 011-3391960 ama012-320-2943"
so,xuquuqda guriga iyo galmada,ka cawinta xadgubka,"xad gudubku waa wax sharciga k afrika kan soo hor jeeda hel kuwo si bilaasha kuu cawiya sida ciyaalka iyo haweenka ama wac 0800-150-150 si laguu caawiyo talona laguu siiyo"
so,xuquuqda guriga iyo galmada,arimaha khuseeya xuquda in laga cawiyo xadgubka,"haweenka iyo carurta waxay heli karam difaac iyu xuquuq noc kasta oo ka mida xadguduka wana in lala xidhidho booliska difaacid waxayna kii surta galin ilalin fara badan waxaa suurta gal ah in lagugu sameyay xad gudub galmo ama mid jidh ah ama aad lumisay xoriyadada xadgubka dumarka, ciyaalka waa sharic dar k afrika"
so,xuquuqda guriga iyo galmada,war galinta xadgudubka,"hadii adiga ama ilmahaaga u dhib qabo kaas. Waalid ka boolisku waxay kuu furayaan kiis in danbi lagaa galay wana in aad booliska u sheegto. Waxa ku helay waxay ku furi kiis boolisku waxay leeyihiin hayado u xilsaaran arimaha xadgububka galmada iyo difaaca ciyaalka. Booliska kugu dhaw waxanad he;aysa dawo iyo talo"
so,xuquuqda guriga iyo galmada,difaacida,"Hadaad ka cabsato qalaalse badan ama hanjabaad badan. Waxaad aadi kartaa maxkamada waxayna ku siin difaacid.Codsiya umana baahnid sharci yaqaaan xadgububkana.Hadad laga buriya guriga. Lacalhaday wax kugaran dawac ama wax lamiid aah. waxad gen maxakamaad.leeh cadeen.waxa ladira warqaad xariig."
so,xuquuqda guriga iyo galmada,armar diidada iyo be o boxska,"Ku xad gudbuhu haduuna ahayn mid u dalabka waad xidhi kartaa. Marka labaad waa in aad maxkamada walibana waa in uu kula socdo ku xad gudbuhu. Markaas waxaa maxakamadu in ay ku sii so difaac kama danbaysa waa hadii uuna u hogaansamine dalabka maxkamada isaga ama iyada markaas waa la xidha."
so,xuquuqda guriga iyo galmada,ganacsiga,"Ganacsiga bili adamka waxuu dhacaa kaliya marka dad ay adan wadan. Sharciya ama wax aan sax ahayn uga faa in ay ka waxayna ugu shaqaystaan. Ahwaxayna wax kasta lagu tilmaami karaa casriga ah waxaad la xidshiiidhi kartaa ururada caalamiga ah e socdaalka 0800-555-999 ama aad booliska waxaaad ogaan cida ku shaqa leh"
so,bilaa gurga ah,guri la aanta,"Qaran la aan waa qofka aan lahayn waa qof aan haysan. Mid kastaba qarka u saaran tahay in aad qaran. Aan tahay hadii dhalashadu tahay mid aan lagu go aan qadan taaas maha dhamaan. Qaran la aantu waa tusaale marka adan haysan diwaan galin dhalasho aqoonsi warqada ama baasaboor."
so,bilaa gurga ah,khatarta,"Qof aan lahayn sharci waxuu khatar u yahay qaran la aan marka uu helo waxoo guul ah am dhiba. Dhimashada ama ka maqanan ta meel dagaal ama sugida soo galootinimo. Arimaha goynta xadadka isku darka dhalashooyin warqada oganshahaga marka ayna kuu samaxayn in aad goyso xadka sababta is la hansha la aanta dhalasho."
so,bilaa gurga ah,diwaan galita dhalmada,"Warqada dhalashadu waxay cadaynaysaa goobta aad ku dhalatay waxayna cadaynaysaa walidkaaga. Dhalashadada gar ahaan dadka haysta dhalashada SA lkn kayimid macnaheedu maaha in dhalan ku dhasha wadanka SA. Llagu diwaan galiyo 30cisho hadii kale waa in laga galiyo dhib dhaca ah la xidhaa bisha dhiseenbar codsiyada."
so,bilaa gurga ah,helida dhalashada,"hadii sheegashadaadu tahay dhalasho k afrika ah ama hadii waalidkaa ku dhashay wadanka waxaa muhiim ah xiliga dhalashada iyo goobta aad ku dhalatay ama hadii walidku ahaa mid daganaasho ka helay wadanka oo markaas adna aad dhalatay ama hadii aad ku noolayd wadanka ilaa intii aad ka gaadhay 18 sano waxaad xaq u lahayd dhalasho wadanka ah codso adiga oo raacinaya codsigaaga si dhexdhexaada taas oo ka imanaysa waxda sharciyada hubi in ay surta gal tahay qof ku in uu heli karo laba dhalasho"
so,bilaa gurga ah,talo sharciga khusaysa,"hadii aad la dhiban tahay in aad is diwaan galiso ama dhalashada wadan kaaga la xidhiidh hayada sharciyaqaanada Q,ADAMAHA U DOODA011-320-2943 caawinta ama waanada"
